Fecha Extraccion,Titulo,Fecha Publicacion,Tema,Resumen,URL,Imagen,Empresa,Autor,Contenido,RelNewsUrls
2022-09-01 14:00:03,SEC formula los cargos contra Enel por no atender reclamos de forma oportuna,07/07/2022,CHILE,Esto se da a una semana que la entidad formulara cargos contra Enel Transmisin por su eventual responsabilidad en el corte de suministro del 12 de mayo y que afect a casi 230 mil clientes.,https://www.larepublica.co/globoeconomia/sec-formula-los-cargos-contra-enel-por-no-atender-reclamos-de-forma-oportuna-3398668,"data:image/svg+xml,%3Csvg xmlns='http://www.w3.org/2000/svg' viewBox='0 0 1080 900'%3E%3C/svg%3E",Enel,DIARIO FINANCIERO - SANTIAGO,"La Superintendencia de Electricidad y Combustibles (SEC) formul cargos contra la empresa Enel Distribucin por su eventual responsabilidad en dos incumplimientos a la norma tcnica de calidad de servicio relacionados con la oportuna atencin de los reclamos de sus clientes y con la emisin de boletas de consumos estimados.Segn se detalla en un comunicado de la entidad fiscalizadora, el primer cargo est relacionado con que la empresa no fue capaz de cumplir con los estndares exigidos de atencin de los reclamos de sus clientes, es decir, no logr atender, oportunamente, las denuncias de los hogares de la Regin Metropolitana, donde entrega energa energa elctrica.Mientras, el segundo cargo es por incumplir con los estndares normativos asociados a la emisin de boletas con consumos estimados, entre los perodos de diciembre 2021 hasta marzo 2022. De acuerdo a la SEC, esto perjudic a las familias que no recibieron una boleta o factura con la lectura real que registra el equipo de medida, lo cual constituye -aseguraron- una infraccin a la normativa elctrica vigente.""Ms all de las multas que podemos aplicar, como SEC lo que nos interesa es que empresas como Enel mejoren sus estndares y cumplan con las exigencias de la norma tcnica de calidad de servicio"", sostuvo en el escrito el superintendente (S) de la entidad, Mariano Corral.Adems, la autoridad enfatiz la relevancia que los ciudadanos denuncien cuando no sean atendidos oportunamente o cuando no reciben sus boletas de consumo con la lectura real del medidor en los perodos habituales.En esa lnea, la SEC explic que el primer llamado es a denunciar en la misma empresa que le entrega energa y, si es que no responden o la respuesta es insatisfactoria, se puede presentar el mismo reclamo ante la Superintendencia.Este hecho se da a una semana que la SEC formulara cargos contra Enel Transmisin por su eventual responsabilidad en el corte de suministro elctrico ocurrido en la tarde-noche del 12 de mayo de este ao y que afect a casi 230 mil clientes.",[]
2022-09-01 14:00:03,Enel Colombia refuerza subestaciones subterrneas para prevenir defectos por lluvias,29/06/2022,ENERGA,"Hasta el momento la compaa ha impermeabilizado con resina a 56 de las 160 estructuras, ubicadas en zonas cercanas a Bogot",https://www.larepublica.co/empresas/enel-colombia-refuerza-subestaciones-subterraneas-para-prevenir-defectos-por-lluvias-3393449,"data:image/svg+xml,%3Csvg xmlns='http://www.w3.org/2000/svg' viewBox='0 0 1080 900'%3E%3C/svg%3E",Enel,CRISTINA ESTRADA RUDAS,"Con una inversin cercana a los $800 millones, Enel Colombia viene ejecutando un plan de mantenimiento preventivo en ms de 160 subestaciones subterrneas de distribucin, que durante la poca de lluvias se afectan por inundaciones, lo cual genera fallas en la prestacin del servicio de energa elctrica.Hasta el momento la compaa ha impermeabilizado con resina a 56 de estas estructuras, en las localidades de Chapinero, La Candelaria, Teusaquillo y Puente Aranda, en Bogot, zonas que han sido identificadas como las ms afectadas por el nmero de fallas asociadas a inundaciones, por medio del monitoreo permanente del sistema de operacin de la Compaa.Los trabajos consisten en la impermeabilizacin de la infraestructura con materiales utilizados en tneles y diques de centrales hidroelctricas, accin que garantiza el sellamiento de fisuras, la eliminacin de las filtraciones y el aislamiento del agua para mantener las superficies secas.Este plan de accin seguir ejecutndose durante lo que resta del 2022 y, ampliar su cobertura a otras localidades de Bogot, esperando alcanzar 50 subestaciones ms, para lo cual se estima una inversin adicional de $350 millones.Enel Colombia busca permanentemente brindar soluciones ante los retos que enfrenta el servicio de distribucin de energa elctrica. Por esta razn, le apostamos a nuevos recursos que no solo permitan gestionar la operacin de manera eficiente, sino que generen el menor impacto para los clientes y, gracias al refuerzo del revestimiento de las subestaciones subterrneas de distribucin con una resina hidroexpansiva, se puede reducir las fallas causadas por inundaciones, afirm Francesco Bertoli, gerente de Infraestructura y Redes de Enel Colombia.Durante la ejecucin de este plan, Enel Colombia ha permitido que el recurso de vactor, para desaguar las instalaciones elctricas subterrneas, haya podido atender situaciones en otros sectores de la operacin optimizando los tiempos de respuesta ante emergencias.Los trabajos efectuados por Enel Colombia reiteran el compromiso de continuar robusteciendo la infraestructura elctrica de Bogot, para tener un sistema de distribucin de energa estable, confiable y seguro, que genere bienestar para los habitantes de la ciudad, puntualiz Francesco Bertoli.",['https://www.larepublica.co/globoeconomia/enel-acuerda-la-venta-de-la-termoelectrica-termofortaleza-en-brasil-por-us-96-millones-3381723']
2022-09-01 14:00:03,Con una inversin de $10.000 millones Enel logr culminar la subestacin Morato,14/06/2022,ENERGA,"Cerca de 350.000 personas y habitantes de las localidades de Suba, Engativ y Barrios Unidos se vern beneficiadas con el mejoramiento del servicio",https://www.larepublica.co/empresas/con-una-inversion-de-10-000-millones-enel-logro-culminar-la-subestacion-morato-3383760,"data:image/svg+xml,%3Csvg xmlns='http://www.w3.org/2000/svg' viewBox='0 0 1080 900'%3E%3C/svg%3E",Enel,ALLISON GUTIRREZ NEZ,"La empresa de energa Enel inform que culmin los trabajos de modernizacin y ampliacin de la Subestacin Morato, ubicada al norte de Bogot, en la carrera 70 con calle 96.El proyecto, que tuvo una inversin de $10.000 millones, buscar que cerca de 350.000 personas y habitantes de las localidades de Suba, Engativ y Barrios Unidos, se beneficien con un servicio de energa de mejor calidad.As mismo, se cambiaron dos de los transformadores de potencia, por unos de mayor capacidad, ampliando la cobertura de distribucin en el norte de Bogot, y atendiendo la creciente demanda de energa de la ciudad. La nueva Subestacin Morato pas de tener una capacidad de 100 millones de voltamperios (MVA), a una de 120 MVA, con 20 circuitos de media tensin, que son los responsables de la distribucin del servicio para los clientes residenciales, comerciales e industriales de Suba, Engativ y Barrios Unidos asegur Alejandro Rincn, subgerente de Gestin de Proyectos y Construccin de Enel.En cuanto a la modernizacin, esta consisti en el cambio y actualizacin tecnolgica de diferentes
equipos de esta infraestructura, tanto de potencia, como de proteccin y control.La empresa de energa indic que tambin adecu la conexin de las tres lneas de transmisin de la Subestacin Morato: Salitre, Usaqun y Suba; y se desconectaron y retiraron los equipos que ya haban cumplido su vida til.",['https://www.larepublica.co/globoeconomia/las-demandas-energeticas-en-viviendas-deberan-atenderse-con-energias-limpias-3383207']
2022-09-01 14:00:03,Enel acuerda venta de termoelctrica en Brasil por US$96 millones,10/06/2022,ENERGA,Termofortaleza es una central trmica a gas con capacidad mxima de 327 MW,https://www.larepublica.co/globoeconomia/enel-acuerda-la-venta-de-la-termoelectrica-termofortaleza-en-brasil-por-us-96-millones-3381723,"data:image/svg+xml,%3Csvg xmlns='http://www.w3.org/2000/svg' viewBox='0 0 1080 900'%3E%3C/svg%3E",Enel,DIARIO FINANCIERO - SANTIAGO,"La filial brasilea de Enel suscribi un acuerdo paravender el 100% de las acciones emitidas por CGTF (Central Generadora Thermoelctrica Fortaleza) a la carioca Eneva.De acuerdo con un hecho esencial enviado por la firma italiana, ""el principal activo operativo de Termofortaleza es la UTE Fortaleza, una central trmica a gas, con una capacidad instalada mxima de 327 MW, ubicada en el municipio de Caucaia, Estado de Cear en el noreste de Brasil"".Asimismo, con esta transaccin Enel Brasil recibir US$96 millones, los cuales estn sujetos a ajustes de los trminos del acuerdo. En ese sentido, las partes acordaron una forma de pago relacionado con el desempeo de Termofortaleza, lo que supondra hasta US$20 millones.Enel seal que esta decisin de desinversin est en lnea con su plan de descarbonizacin, lo cual contempla una prdida en los estados de resultado de US$ 162 millones.Eneva es una generadora elctrica fundada en Ro de Janeiro en 2001.Enel Geracin Fortaleza posee una de las tecnologas ms avanzadas en generacin de energa trmica del pas, produciendo energa en ciclo combinado de gas y vapor. Con una capacidad de generacin de 326,6 MW (datos de 2016), cuenta con una lnea de transmisin de alta tensin (230kV) de 1,2 km.",[]
2022-09-01 14:00:04,Enel inaugura subestacin en el centro de Bogot bajo una inversin de $26.000 millones,19/05/2022,ENERGA,La localidad de los Mrtires fue la escogida para poner en funcionamiento la nueva subestacin y sus dos lneas de conexin asociadas,https://www.larepublica.co/empresas/enel-inaugura-subestacion-en-el-centro-de-bogota-bajo-una-inversion-de-26-000-millones-3366777,"data:image/svg+xml,%3Csvg xmlns='http://www.w3.org/2000/svg' viewBox='0 0 1080 900'%3E%3C/svg%3E",Enel,GERALDINE BARONA,"En el marco del Plan Integral de Renovacin, la empresa distribuidora de energa puso en funcionamiento la subestacin elctrica San Jos la cual atender la creciente demanda que ha tenido el sector relacionados a infraestructura y vivienda. Esta sede de energa cont con una inversin de $26.000 millones.En los detalles de construccin de la subestacin se encuentra la modernizacin en su funcionamiento gracias a la introduccin de tecnologa, la construccin de 20 circuitos de media transmisin, desmonte de la infraestructura anterior, aumento de la capacidad en las lneas de transmisin y la inclusin de dos transformadores de potencia de 40 millones de voltamperios cada uno. Esto ltimo emplea una capacidad total de 80 MVA, equivalente al consumo energtico del municipio de Zipaquir.Para Francesco Bertoli, gerente de infraestructura y redes de Enel Colombia, la puesta en funcionamiento de la nueva Subestacin San Jos da cuenta de nuestro compromiso con el plan de expansin de subestaciones de alta tensin que nos hemos trazado, cuyo objetivo es fortalecer la infraestructura elctrica, atender la creciente demanda de energa requerida para el desarrollo econmico e industrial del centro del pas, y mejorar los niveles de confiabilidad, estabilidad, seguridad y calidad del servicioLa construccin y mejora de la subestacin cont con la participacin de habitantes del sector enmarcado en una estrategia de economa circular, incluyendo a recicladores, habitantes de calle, comunidad LGBTI, entre otros, quienes aportaron en el embellecimiento del muro exterior.",[]
2022-09-01 14:00:04,"Enel, con financiacin de Bancolombia, llevar energa a zonas rurales de Cundinamarca",17/05/2022,ENERGA,"La empresa de energa solicit a la entidad bancaria un crdito bajo la lnea Agro Sostenible por $250.000 millones, que llevar el servicio a 5.000 nuevos clientes",https://www.larepublica.co/empresas/alianza-de-enel-y-bancolombia-llevara-energia-electrica-a-zonas-rurales-de-cundinamarca-3364939,"data:image/svg+xml,%3Csvg xmlns='http://www.w3.org/2000/svg' viewBox='0 0 1080 900'%3E%3C/svg%3E",Enel,ALLISON GUTIRREZ NEZ,"Enel Colombia, en medio de su plan de inversin en infraestructura, y con la ayuda de la financiacin de Bancolombia, construir y modernizar la infraestructura elctrica del sector agroindustrial en el departamento de Cundinamarca. Dicho plan llevar energa elctrica a familias de Cundinamarca que an no cuentan con este servicio y atender la creciente demanda energtica del sector del agro.Para esto, la empresa de energa solicit un crdito a Bancolombia que le permitir llevarle el servicio a ms de 5.000 nuevos clientes residenciales en zonas rurales, de los cuales al menos 680 estn en terrenos aislados. Tambin cuatro grandes clientes agroindustriales ubicados en esta zona sern impactados al poder optimizar sus procesos productivos y apalancar la competitividad de la regin. ""Sin duda, llevar energa a zonas rurales y apartadas, nos permite contribuir con su calidad de vida, con el acceso a un servicio confiable y seguro, asegur Lucio Rubio Daz, director general de Enel Colombia.Con esto, los habitantes de los sectores beneficiados podrn acceder a su derecho a tener servicios bsicos como la electricidad y podrn eliminar sustitutos energticos como lea, velas, plantas y lmparas de disel previamente utilizados, con lo cual se calcula que cada nuevo usuario identificado en los terrenos aislados podr reducir anualmente la emisin de hasta 27 toneladas de CO2.Comprometidos con apalancar el acceso a la energa elctrica en el departamento de Cundinamarca, este crdito otorgado por Bancolombia nos permitir llevarle el servicio a ms de 5.000 nuevos clientes residenciales en zonas rurales, de los cuales al menos 680 estn en terrenos aislados. Tambin cuatro grandes clientes agroindustriales ubicados en esta zona sern impactados favorablemente al poder optimizar sus procesos productivos y apalancar la competitividad de la regin. Sin duda, llevar energa a zonas rurales y apartadas, nos permite contribuir con su calidad de vida, con el acceso a un servicio confiable y seguro, agreg Lucio Rubio Daz, director general de Enel Colombia.Las inversiones de Enel Colombia tambin incluyen la implementacin de equipos de telecontrol, con lo cual se podr atender el crecimiento de la demanda, mejorar la calidad del servicio y gestionar de forma ms eficiente la identificacin de fallas en la red para reducir las interrupciones del servicio.",['https://www.larepublica.co/empresas/enel-colombia-superara-los-5-000-megavatios-de-capacidad-instalada-antes-de-2024-3344970']
2022-09-01 14:00:04,"Construccin de la primera lnea del Metro de Bogot presenta un avance de 14,34%",30/04/2022,BOLSAS,"El proyecto tiene una extensin de 23,9 kilmetros, lo que incluye 35,9 hectreas de patio taller y 30 trenes de entre seis y siete vagones",https://www.larepublica.co/infraestructura/construccion-de-la-primera-linea-del-metro-de-bogota-presenta-un-avance-de-14-34-3353999,"data:image/svg+xml,%3Csvg xmlns='http://www.w3.org/2000/svg' viewBox='0 0 1080 900'%3E%3C/svg%3E",Enel,IVN CAJAMARCA,"Despus de casi 50 aos de, al menos, media docena de anuncios que daban por hecho el inicio de la construccin del metro en Bogot, desde enero de 2017 inici, oficialmente, la fase previa de la primera lnea de este sistema de transporte. Hasta el momento, el proyecto lleva un avance fsico de ejecucin de 14,43%, y de 7,89% en el aspecto financiero, con $1,02 billones ejecutados.Este es un proyecto que ir desde el Portal Amricas hasta la Avenida Caracas, atravesando la Avenida Villavicencio, la Primero de Mayo, la Calle 8 Sur y la Calle 1, por donde girar hacia el norte, ocupando la Avenida Caracas hasta la Calle 78. Los 23,9 kilmetros de trazado incluyen un ramal tcnico, entre el patio taller y la primera estacin, y un tramo de maniobras de retorno en la Avenida Caracas, entre Calles 74 y 78.El patio taller tendr una extensin de 35,9 hectreas, disponibles para 30 trenes para operar, los cuales estarn integrados por entre seis y siete vagones con capacidad para 1.800 pasajeros y una velocidad promedio de 43 km/h. El costo presupuestado hasta ahora es de $12,94 billones, cuya financiacin se encuentra distribuida entre el Distrito y el Estado.Se prev que el desarrollo de la infraestructura de la primera lnea de metro ms extensa del continente se divida en tres etapas: previa, construccin y pruebas, certificaciones y puesta en marcha. Por ahora, la primera parte ir hasta 2023 e incluye, aparte de la definicin de temas operativos y financieros, el traslado anticipado de redes.Avanzamos en la obra del patio taller. Desde 2021 hacemos actividades de excavaciones o rellenos y traslado de redes. Desde 2025 montaremos las vas frreas dentro del patio taller.El objetivo de estas obras es despejar el corredor del metro de todo tipo de tuberas y cables, para minimizar posibles demoras en las obras. En este caso sern 115 trabajos. Los primeras 26 estn a cargo de Empresa de Acueducto de Bogot, cuya empresa se encarga de las tuberas hidrosanitarias.A este le siguen 39 obras en torno a ductos, cables de telefona y semaforizacin, a cargo de ETB; 7 obras en ductos y torres elctricas, a cargo de Enel; 11 obras en tuberas de gas, a cargo de Vanti; y 32 obras en ductos de redes de fibra ptica, a cargo de TelefnicaSegn, Wu Yu, representante legal del concesionario Metro Lnea 1, avanzamos en la obra del patio taller. Desde 2021 hacemos actividades de excavaciones o rellenos y traslado de redes. Desde 2025 vamos a montar las vas frreas dentro del patio taller y construiremos las edificaciones.","['https://www.larepublica.co/economia/con-proyectos-de-2021-2022-subieron-4-los-kilometros-de-redes-de-energia-del-pais-3353165', 'https://www.larepublica.co/economia/el-invias-invierte-1-8-billones-de-recursos-en-risaralda-para-mejorar-790-kilometros-3348934']"
2022-09-01 14:00:04,Starace pide acelerar inversiones en redes y anuncia cambios en salida de Bocamina,18/04/2022,ENERGA,"Chile, Brasil y Mxico. Esas fueron las paradas del viaje que realiz la semana pasada el CEO de Enel, Francesco Starace, para -segn cuenta- empezar de nuevo a ver cmo van las cosas, sentir el pulso de este nuevo marco, cmo estamos",https://www.larepublica.co/globoeconomia/starace-pide-acelerar-inversiones-en-redes-y-anuncia-cambios-en-salida-de-bocamina-3344387,"data:image/svg+xml,%3Csvg xmlns='http://www.w3.org/2000/svg' viewBox='0 0 1080 900'%3E%3C/svg%3E",Enel,DIARIO FINANCIERO - SANTIAGO,"Hace cinco aos que el ejecutivo del grupo energtico italiano no pisaba suelo chileno. Fue la primera escala, dice, porque los cambios que pasaron estos aos son muy importantes: Me interesa mucho ver cmo podemos seguir creciendo y seguir invirtiendo en este pas y cmo es mejor hacerlo. Para nosotros es un pas muy importante en la zona.En entrevista con Diario Financiero, Starace desdramatiza la postergacin del retiro de la central Bocamina II, central que actualmente se encuentra sin funcionar luego de que trabajadores se tomaran el acceso del recinto buscando ser escuchados ante la incertidumbre que les genera el proceso de cierre.
Adems, si bien asegura que en Chile hay un marco regulatorio claro, cree que se necesitan cambios para acelerar la inversin en redes.Qu piensa el grupo para Chile?-Tenemos algo as como 3.000 MW en construccin en diferentes etapas y esto nos permite llegar a la casi completa descarbonizacin, pero eso es no crecer en nuestra posicin, sino que simplemente sustituir. Pero hay un tema que surge en Chile muy fuerte que es la progresiva electrificacin de los consumos energticos, no solo el crecimiento de las renovables, sino que algunos sectores industriales que eligen la electricidad como forma energtica. Un ejemplo es el transporte pblico urbano, los autos elctricos, la calefaccin, y empujar esto es la novedad de este perodo del 2020 al 2030. La electricidad empieza a ser utilizada en cosas y aplicaciones que antes no se consideraban.Y cmo cambia el sistema elctrico si hay millones de autos? Cmo tiene que cambiar el sistema de distribucin para que esto sea conveniente y seguro? Dnde tenemos que invertir? Porque hay energas renovables, pero cmo llega esta energa y cmo se utiliza hay que pensar en bateras, flexibilidad, sistemas digitales. Y cmo todo esto puede servir? Puede ser un servicio a Chile o a otros? Estas son las preguntas en que estamos buscando las respuestas.Cmo se conjugan los desafos globales con los de la regin, especficamente en Chile, donde hay riesgo de racionamiento elctrico?Hay regiones ms expuestas, pero es solo una cuestin de tiempo (...) No creo que si un pas mejora toda su impronta de carbono, pero el resto del mundo no lo hace, cambia algo. Esto es algo bastante nico de la transformacin, lo tenemos que hacer todos, en particular las economas ms grandes.Y cmo ha visto el proceso en Chile? Bocamina II se ha convertido en un caso emblemtico donde se ha tenido tensiones con la autoridad por la fecha de retiro.En todos los pases hay siempre una o dos centrales emblemticas. En este caso es Bocamina, pero podra ser otra. Por qu es emblemtica? Porque se toma como una seal donde la gente entiende que se acaba todo cuando se apaga esta central. Es un proceso, se puede terminar ese ao, el ao que viene o en seis meses, y no cambia nada, porque econmicamente no tiene sentido, porque las renovables son ms baratas, ms simples. No es una decisin ideolgica, es econmica.Cuando estemos seguros que se puede acabar con Bocamina, se termina y nada ms.Cul es su reflexin de la posicin que ha tenido Chile en las ltimas dcadas para el grupo?Chile ha tenido un rango muy importante de inversiones en los ltimos 10 aos, con un par de aos ms flacos... Tenemos una visin de que la economa chilena seguir creciendo. Tenemos una situacin -a pesar de la Constitucin y el estallido social- bastante clara con una confianza en el hecho de que el pas no va a cambiar de manera negativa.En noviembre vean ciertas incertidumbres en Chile,  se han ido disipando? El nuevo gobierno ha dado mayores certezas?Claro que s. Cualquier nuevo gobierno tiene muchas cosas que mirar y no somos los nicos, pero me parece que es un gobierno que est empezando a mirar las cosas. La agenda de este gobierno est completamente en lnea con la descarbonizacin, la progresiva determinacin del consumidor, que el consumidor tericamente podra ser tambin un productor de generacin a tamao pequeo...No ha motivado a pausar inversiones o mirar con ms calma?No, porque es la Constitucin de un pas. Para nosotros es muy importante el marco regulatorio de la red, pero para los chilenos es mucho ms importante la Constitucin. Pero no tenemos miedo de que en esta Constitucin se emplacen conceptos extremadamente complejos. Ese es un debate muy fuerte, pero mejor as que un silencio o una rebelin. Entiendo que cada chileno tiene una visin propia de esto. Para m es difcil meterme, ya que estoy afuera del pas.Han sido cautelosos respecto al hidrgeno verde, hay algn plan, al menos en Chile, de hacer una inversin relevante?Todo lo que estamos hablando acerca de hidrgeno verde se basa sobre una hiptesis, que el hidrgeno verde se pueda generar a un coste competitivo. Estamos enfocados en cmo concretar la hiptesis, trabajar hasta que este coste de produccin del hidrgeno verde sea barato, como mnimo, como el hidrgeno gris.Y cunto cree que falta para saber eso?Si en tres o cinco aos el coste de generacin de hidrgeno se reduce en 30%-40%, es una seal de que lo puedes lograr. Pero si en tres aos se mueve 5%, djalo. No todas las tecnologas nuevas son de xito.Otras movidasNo solo Chile est visitando en estos das el CEO de Enel, Francesco Starace, quien tambin ir a Brasil y Mxico, mercados claves para crecer, as como a Colombia, donde acaban de concretar una reorganizacin.
Consultado sobre los cambios polticos que se ven en Latinoamrica, el ejecutivo indica que es una suerte esta regin, en mencin a su alejana de los grandes conflictos mundiales como es el caso de la guerra Rusia-Ucrania.No hay actos de terrorismo en esta parte del mundo desde hace 20 aos. No tienen guerras... Hay cambios polticos, gracias a Dios, porque significa que hay democracias que funcionan, resalta.En su visin sobre el escenario latinoamericano, valora que es una gran regin, con un increble crecimiento demogrfico, econmico, con desafos de transformacin social, pero no conflictos ideolgicos e invasiones.
Sobre sus planes para los mercados que la compaa opera en esta parte del mundo, sostiene que ya pasaron las grandes reorganizaciones societarias, aunque manifest que siempre se pueden hacer ajustes. Lo ideal es que en cada pas podemos tener una compaa como la que tenemos en Chile, dijo aludiendo al paso que dieron en Colombia recientemente.Lea completa aqu: http://ow.ly/JNh650ILtba",[]
