Fecha Extraccion,Titulo,Fecha Publicacion,Tema,Resumen,URL,Imagen,Empresa,Autor,Contenido,RelNewsUrls
2022-09-01 13:56:50,Petróleo verde,17/08/2022,ANALISTAS,,https://www.larepublica.co/analisis/simon-gaviria-munoz-401830/petroleo-verde-3426069,"data:image/svg+xml,%3Csvg xmlns='http://www.w3.org/2000/svg' viewBox='0 0 600 600'%3E%3C/svg%3E",Ecopetrol,SIN AUTOR,"Sin pena ni gloria, en marzo de 2022, Ecopetrol exportó sus primeros barriles verdes de petróleo. Esta venta de millón de barriles, se compensó ambientalmente con 32.000 toneladas de bonos de carbono. Aún con reparos de efectividad, el petróleo verde, donde se obliga a compensar la afectación ambiental, es el futuro. Antes de asfixiar los hidrocarburos, se podría explorar una transición energética. Una decisión abrupta, a parte de inmensos costos económicos, afectaría la posibilidad de lograr recursos para salvar ecosistemas. Inclusive, bien diseñado, el petróleo verde podría ser menos contaminante que la prohibición.Colombia no debe permitir ninguna actividad que no pueda compensar su afectación. El fracking es dañino, mientras no pruebe lo contrario, no se debe permitir. Su prohibición no tiene impacto social ni económico y podría prevenir un gran daño ambiental. Inclusive se debe elevar los estándares ambientales sobre la actual producción. Colombia debe ser líder mundial en transición energética, puede poner ejemplo en hidrocarburos.No somos un país petrolero, pero si produce mucho petróleo. Estamos entre el puestos 20 y 25 del escalafón de producción mundial. Durante 2021, gracias al covid y a la mala gestión de la ANH, Colombia registró la producción más baja de hidrocarburos de los últimos 12 años. Aunque gracias a precios altos durante 2022, se logró incrementar en abril la producción diaria a 755.000 barriles. Es una bonanza que se esta dejando sobre la mesa.Dependiendo del precio, esta cadena, con todos sus gravámenes, aporta entre 3,5%-4,5% del PIB de los ingresos, entre directos e indirectos este año debe ser como $39 billones. Las regalías petroleras para 70% de los departamentos, son su principal fuente de inversión. Esto sin considerar que cerca de 55% de los dólares que entran al país son de hidrocarburos. Frenar la exploración no tiene efectos inmediatos, pero a partir de 2023 contribuye a la devaluación y menores ingresos. Con nubes de recesión global y altas tasas de interés, Sin estos recursos, será más difícil el desarrollo rural, mejoras en educación y un más justo sistema de salud.Permitir que se explote petróleo verde no solo permitiría aliviar la carga fiscal, sino que se podría sobre-compensar para que fuera negativa su contribución de gases efecto invernadero. Se crearía un mercado interno de bonos de carbono que salvaría ecosistemas como el Amazonas y podría darles una vida digna a comunidades rurales. En cálculos personales, al sobre pasar los US$23 tonelada de compensación por captura de carbono, es mejor para el campesino cuidar el bosque que deforestar. Hoy el mercado nacional esta en US$4, el voluntario internacional entre US$7-14.La ley de cambio climático en 2018 le dio tres años para crear un mercado de bonos de carbono, cosa que no ocurrió. La nueva administración podría tener esta victoria temprana. La tributaria en vez de poner impuesto a la exportación debería crear una sobre tasa de renta, con tal de financiar la salvación de los principales ecosistemas, un mecanismo similar al impuesto al carbono. La transición energética más que un ejercicio fiscal, requiere atrincherarse en la protección ambiental, mientras las inversiones de transición se ejecutan. De un día para el otro, es difícil.",[]
2022-09-01 13:56:51,Ecopetrol suscribió un contrato para compra y venta de energía eléctrica con Gecelca,16/08/2022,ENERGÍA,"Se espera que la ejecución del contrato comience en las próxima semanas, cuando se cumplan con los respectivos trámites de registro",https://www.larepublica.co/empresas/ecopetrol-suscribio-contrato-de-comercializacion-de-energia-electrica-con-gacelca-s-a-3425427,"data:image/svg+xml,%3Csvg xmlns='http://www.w3.org/2000/svg' viewBox='0 0 1080 900'%3E%3C/svg%3E",Ecopetrol,NICOLÁS ESCOBAR ESCOBAR,"Ecopetrol, en cabeza de Felipe Bayón, por su retiro de las actividades de comercialización de energía eléctrica, derivado de la adquisición de 51,4% de las acciones de circulación de Interconexión Eléctrica S.A E.S.P y del cumplimiento de la regulación de energía de Colombia, suscribió un contrato para la comercialización de energía eléctrica con Gecelca S.A E.S.P.De esto da cuenta un comunicado. Este contrato tiene como objetivo la atención de la demanda de energía no regulada del grupo Ecopetrol y su plazo se extiende hasta el 31 de diciembre de 2036, teniendo como propósito asegurar un esquema para el suministro de energía mediate el Sistema Interconectado Nacional (SIN) para que se pueda optimizar el costo y la cobertura necesaria.Para elegir a esta empresa, se realizó un proceso competitivo al cual fueron invitados 17 agentes entre generadores y comercializadoras del mercado de energía mayorista, según informó Ecopetrol. Hay que tener en cuenta que, el monto del contrato, es el resultado de las cantidades estimadas de energía requeridas en la operación por la tarifa final a pagar por el Grupo Ecopetrol.Esto se obtiene de la suma de los componentes característicos del costo de la energía, que incluye generación, transmisión, distribución, comercialización y otros en el mercado nacional, informó la estatal petrolera. La ejecución de esto se realizará en las próxima semanas, cuando se cumplan con los trámites de registro e inscripción ante el administrador del Sistema de Intercambios Comerciales del mercado de energía mayorista de Colombia.",[]
2022-09-01 13:56:51,"Con $10,5 billones en ingresos, el Grupo Argos es la tercera empresa más vendedora",13/08/2022,INDUSTRIA,"Ecopetrol lidera el ranking con ingresos por $76,4 billones y ganancias netas que estuvieron por encima de $17,1 billones a junio",https://www.larepublica.co/empresas/con-10-5-billones-en-ingresos-el-grupo-argos-es-la-tercera-empresa-mas-vendedora-3424156,"data:image/svg+xml,%3Csvg xmlns='http://www.w3.org/2000/svg' viewBox='0 0 1080 900'%3E%3C/svg%3E",Ecopetrol,NATALIA GAVIRIA GONZÁLEZ,"En el recopilado de los resultados de las empresas que han reportado al cierre de junio sus balances financieros, la petrolera Ecopetrol sigue liderando la partida por ingresos.Lo mantiene, pese a las afectaciones económicas del covid, pues la compañía ha venido creciendo desde el segundo semestre de 2020 y, además, con cifras históricas.De enero a junio, la compañía estatal reportó ventas por $76,4 billones, con ganancias netas que rondaron $17,1 billones. El Ebitda registró un total de $22,2 billones, con un margen por encima de 51%.Felipe Bayón, presidente de Ecopetrol, atribuyó estos resultados “al esfuerzo y compromiso de los más de 18.000 colaboradores directos y todos los contratistas. Y a las metas de crecimiento, diversificación y rentabilidad del plan financiero”.En la lista continúan Grupo EPM, Grupo Argos, Grupo Éxito, Nutresa y Enel, que totalizaron $47,9 billones de ingresos consolidados en el primer semestre de operación del año en vigencia.Por ejemplo, Grupo EPM logró ingresos de $15 billones y un Ebitda de $4,7 billones, así como una utilidad de $2,1 billones.Seguido apareció el Grupo Argos, cuya cifra de ventas reportadas en el semestre fue de $10,5 billones, mientras que la de utilidades y el Ebitda se ubicaron en $726,0 millones y $2,6 billones, respectivamente. Desagregado de su grupo, la filial Cementos Argos fue la que reportó los ingresos más altos para el primer semestre del año, con $5,4 billones, gracias las buenas dinámicas comerciales en Estados Unidos y Colombia, indicó el Grupo Argos. Su filial de energía, Celsia, registró resultados históricos por $2,5 billones. “Grupo Argos cuenta con fundamentales sólidos que demuestran su capacidad de generación de valor económico”, dijo Jorge Mario Velásquez, presidente de Grupo Argos.“La energía es una de las formas más contundentes de cerrar las brechas en el país. Eso implicará que la compañía siga fortalecida como se evidenció en los resultados semestrales”.En el cuarto lugar figuró el Grupo Éxito, con ventas consolidadas por un orden de $9,3 billones. Además, $126,8 millones en utilidades. La quinta posición la ocupó Nutresa, con $7,6 billones en ingresos, $2,8 billones en ganancias y $949,9 millones de Ebitda.En los informes más recientes del gremio empresarial, se posicionó en el séptimo lugar la empresa de dulces Colombina; y por debajo Cemex, Mineros y Canacol Energy, ocupando las últimas tres posiciones de este ranking.Por fuera estaría otras empresas como ingresos menores como Construcciones El Cóndor que reportó ventas por $358,04 millones de actividades ordinarias; GCM Mining, con US$101,4 millones; y Enka, con $310,669 millones al cierre del semestre.",['https://www.larepublica.co/empresas/canacol-energy-logro-aumentar-10-las-ventas-de-gas-natural-en-el-ultimo-trimestre-3423172']
2022-09-01 13:56:51,Ecopetrol dice que Colombia debería reducir impuesto de exportaciones planificado,12/08/2022,ENERGÍA,Tendrían que pagar hasta $5 billones en impuestos a la exportación a precios actuales si se aprueba el nivel en US$48 por barril,https://www.larepublica.co/especiales/reforma-tributaria-2022/ecopetrol-dice-que-colombia-deberia-reducir-impuesto-de-exportaciones-planificado-3423819,"data:image/svg+xml,%3Csvg xmlns='http://www.w3.org/2000/svg' viewBox='0 0 1080 900'%3E%3C/svg%3E",Ecopetrol,BLOOMBERG,"El productor de petróleo controlado por el estado de Colombia, Ecopetrol, propone diluir un impuesto a la exportación de petróleo planificado que es una parte importante del programa económico del presidente Gustavo Petro.Ecopetrol le está pidiendo al gobierno, su principal accionista, que suba el precio de referencia para cuando comience a cobrar impuestos a la exportación de petróleo. Un proyecto de ley presentado esta semana incluye un impuesto del 10% a la exportación de petróleo, carbón y oro cuando el precio esté por encima de una referencia internacional, que es US$48 el barril de crudo. Eso se compara con un precio promedio de alrededor de US$105 en los últimos seis meses.El precio de referencia es “demasiado bajo”, dijo el presidente ejecutivo, Felipe Bayón, en una entrevista al margen de una rueda de negocios en Cartagena. “Para mí, el umbral de US$48 tendría que subir”.Una cifra aproximada de entre US$65 y US$70 el barril tendría sentido, dijo. Ecopetrol tendría que pagar hasta $5 billones (US$1.200 millones) en impuestos a la exportación a precios actuales si se aprueba el nivel en US$48. Tal como están las cosas, el gravamen reduciría los pagos de dividendos de Ecopetrol en cerca de la mitad, según Bayón. El beneficio para el gobierno es que recibe los pagos tan pronto como se exporta el crudo, “lo cual entendemos que es relevante”.El gobierno de izquierda de Gustavo Petro, que asumió el cargo el domingo, ha dicho que la reforma fiscal es parte de su plan más amplio para reducir la desigualdad y financiar programas de lucha contra la pobreza. Petro se comprometió a eliminar gradualmente la dependencia de la economía del petróleo y el carbón, que actualmente representan alrededor de la mitad de las exportaciones de Colombia. Como parte de sus promesas de campaña, dijo que no otorgará más licencias de exploración y ha dicho que la transición tomará alrededor de 12 años.En una entrevista radial el viernes, la recientemente nombrada ministra de Minas y Energía, Irene Vélez, reiteró que Colombia no otorgará más contratos de exploración. Desde que Petro fue elegido en junio, las acciones de Ecopetrol han caído 16%.La reforma tributaria tiene como objetivo aumentar los ingresos fiscales de 2023 en el equivalente al 1,7% del producto interno bruto. El proyecto de ley de impuestos también incluye una propuesta que detiene las deducciones por pagos de regalías, lo que significa mayores costos para las empresas de productos básicos.En el evento anual de la asociación empresarial Andi en Cartagena, su titular, Bruce Mac Master, advirtió que los aumentos de impuestos pueden llevar a las empresas a reconsiderar invertir en Colombia. El grupo calcula que la tasa impositiva efectiva para las empresas mineras y de hidrocarburos aumentaría a 87% si se aprueba el proyecto de ley en su forma actual, desde 53% este año.Ecopetrol no solo tiene que lidiar con gravámenes más altos. El gobierno también necesita reembolsarle por subsidiar los combustibles. En lugar de permitir que los precios de la gasolina suban en línea con los del crudo este año, el gobierno limitó los aumentos. Eso significa que a los precios actuales, el subsidio le cuesta al gobierno entre $2 y $3 billones al mes.En marzo de este año Ecopetrol recibió $14,2 billones en circulación, y este mes recibirá alrededor de $3 billones.La administración de Petro ha mostrado disposición a seguir pagando, dijo Bayón, al señalar que el presupuesto del próximo año tiene $19,2 billones destinados para ese pago.“Son muy conscientes y continuaremos trabajando con el gobierno”, dijo Bayón. “Siento la actitud correcta”. Aún así, los nuevos planes tributarios no desacelerarán los planes de inversión de Ecopetrol luego de que presentara ganancias récord en el segundo trimestre.“No queremos ralentizar nuestra inversión”, dijo Bayon. “Los precios están en un buen lugar, nuestra capacidad de ejecución es buena: más plataformas, más pozos en perforación, más instalaciones en construcción”.La producción también ha subido. Ecopetrol produjo 704.000 barriles diarios en el segundo trimestre y en julio subió a 714.000.“En general, las cosas se ven bien”, dijo Bayon. “Pero hay que analizar las implicaciones potenciales de la reforma fiscal y los subsidios a los combustibles, todo el asunto”.",['https://www.larepublica.co/especiales/reforma-tributaria-2022/los-nuevos-impuestos-para-las-exportaciones-que-tocan-el-petroleo-oro-y-el-carbon-3420544']
2022-09-01 13:56:52,"Acciones de Ecopetrol y Preferencial de Bancolombia, las de mayor liquidez a julio",12/08/2022,BOLSAS,"Por el volumen promedio de transacción por operación, la especie que lidera la lista es la del Grupo de Inversiones Suramericana",https://www.larepublica.co/finanzas/acciones-de-ecopetrol-y-preferencial-de-bancolombia-las-de-mayor-liquidez-a-julio-3423546,"data:image/svg+xml,%3Csvg xmlns='http://www.w3.org/2000/svg' viewBox='0 0 1080 900'%3E%3C/svg%3E",Ecopetrol,CRISTINA ESTRADA RUDAS,"El último reporte del Índice de Bursatilidad Accionaria de la Superintendencia Financiera de Colombia (SFC) reveló que las acciones de Ecopetrol y la preferencial de Bancolombia se posicionaron como las de mayor liquidez entre abril y julio 2022.El índice de la SFC mide el promedio mensual del número de operaciones realizadas en los últimos cuatro meses; el valor total de las transacciones efectuadas para cada acción dividido entre el número de operaciones efectuadas; y el valor numérico del índice.En ese periodo de tiempo, las especies de alta liquidez oscilaron en un promedio mensual de operaciones de entre 1.890,25 y 29.245,50 siendo este último el dato que registró la acción de Ecopetrol.Seguido estuvieron la preferencial de Bancolombia, con un promedio mensual de operaciones de 15.896,50; y la preferencial del Grupo Aval Acciones y Valores, con 6.488.Las acciones de las empresas del Grupo Empresarial Antioqueño (GEA) también están entre el listado de las de mayor bursatilidad en los últimos cuatro meses. La especie ordinaria de Bancolombia, además de la preferencial, es una de las que mejor se ubica en la lista, en la tercera posición, con 5.739 operaciones, en promedio. Luego están las del Grupo de Inversiones Suramericana, con 2.657,50 y Grupo Argos, con 1,890,25.Si se desagregan las cifras por el volumen promedio de transacción por operación, la especie que lidera la lista es la del Grupo de Inversiones Suramericana con un total de $157,28 millones, Interconexión Eléctrica ($41,25 millones y Grupo Argos ($38,99 millones).La siguiente categoría, según la medición de la SFC, es la de bursatilidad media. Allí, lideran las acciones de Celsia y las preferenciales de Grupo de Inversiones Suramericana y Davivienda.Entre tanto, un informe de Casa de Bolsa mostró que julio cerró como un mínimo histórico de 10 años en términos de volumen negociado, con $1,18 billones.Por un lado, dicho comportamiento estaría explicado por el alza de tasas por parte de diferentes bancos centrales en el mundo, como la Reserva Federal de Estados Unidos, que subió sus tipos en 75 puntos básicos por segundo mes consecutivo, lo que representa el ajuste más agresivo en más de una generación para frenar la inflación.Según los expertos, el aumento en el interés de los emisores hace que para los inversionistas sea más atractiva la renta fija, dado el menor riesgo, lo que desincentiva la inversión en el mercado accionario.“Los cambios de política monetaria de Estados Unidos alteran el riesgo sistemático: ese riesgo que no se puede diversificar. Cuando suben las tasas de interés en Estados Unidos se incrementan inmediatamente las primas de riesgo de liquidez y mercado a nivel mundial”, explicó Diego Palencia, vicepresidente de investigaciones de Solidus Capital Banca de Inversión.Otro factor que se conjuga en la baja de los volúmenes de negociación de acciones es la temporada de vacaciones, incluso en Wall Street. “Estos periodos son de vacaciones y de pocos operadores, incentivando los bajos volúmenes”, dijo Palencia.La temporada de publicación de balances y resultados financieros, tanto en Estados Unidos como en Colombia, también tendría un efecto en la negociación, pues los inversionistas esperarían a conocer los reportes, para analizar cómo van las compañías.Finalmente, Sharon Vargas, analista de portafolio de Itaú Comisionista de Bolsa explicó que julio fue un mes con bajos volúmenes de negociación, “De por sí julio es un mes de bajo volumen de negociación para el mercado accionario local, pero este mes de 2022 está históricamente bajo. Se debe principalmente a ese nerviosismo internacional que hay por una posible recesión, con datos importantes como el del PIB de Estados Unidos. Eso es lo que tiene a los inversionistas cautos a la hora de invertir”, aseguró.",['https://www.larepublica.co/empresas/ecopetrol-hara-que-el-gas-siga-siendo-fundamental-en-la-canasta-energetica-del-pais-3422356']
2022-09-01 13:56:52,Ecopetrol anuncia que pondrá en funcionamiento 100% la refinería de Cartagena,11/08/2022,ENERGÍA,"Con esta puesta en marcha, la compañía petrolera contaría con 50.000 barriles y garantizaría la seguridad energética del país",https://www.larepublica.co/empresas/ecopetrol-anuncia-que-pondra-en-funcionamiento-100-de-la-refineria-de-cartagena-3422920,"data:image/svg+xml,%3Csvg xmlns='http://www.w3.org/2000/svg' viewBox='0 0 1080 900'%3E%3C/svg%3E",Ecopetrol,MARÍA CAMILA GIL NIEBLES,"Luego del descubrimiento del pozo exploratorio y delimitador Gorgon-2, cerca de 70 kilómetros al sur de la Costa Caribe, en asocio con el operador Shell, quien tendrá 50% de participación, Ecopetrol asegura que pondrá en marcha 100% la refinería de Cartagena, lo que serían 50.000 barriles más.Ante esto, el presidente de Ecopetrol asegura que aún hay mucho trabajo por delante: ""tenemos que mirar los registros, dinámicas, estática y con base en eso tener visión del potencial, eso se demorará un tiempo, pero será un gas que entrará en esta década. En términos de producción son excelentes noticias"", dijo Felipe Bayón, presidente de Ecopetrol.Para la compañía petrolera, el panorama es alentador. Las exportaciones representan 80% para la empresa, lo que son alrededor de 11 a 12 millones de barriles mensuales enviados a mercados asiáticos como India y Corea, así como Estados Unidos y Europa.Con el gobierno, la empresa asegura que han tenido un diálogo constante y constructivo para entender la visión que se tiene desde ambos puntos.",[]
2022-09-01 13:56:52,"""Ecopetrol hará que el gas siga siendo fundamental en la canasta energética del país""",10/08/2022,ENERGÍA,"Felipe Bayón, presidente de la compañía, aseguró que el suministro de energía es clave para cerrar las brechas de los colombianos",https://www.larepublica.co/empresas/ecopetrol-hara-que-el-gas-siga-siendo-fundamental-en-la-canasta-energetica-del-pais-3422356,"data:image/svg+xml,%3Csvg xmlns='http://www.w3.org/2000/svg' viewBox='0 0 1080 900'%3E%3C/svg%3E",Ecopetrol,NATALIA GAVIRIA GONZÁLEZ,"El presidente de Ecopetrol, Felipe Bayón, anunció que con el descubrimiento del pozo Gorgon-2, en aguas ultra profundas en el sur del Caribe colombiano, ya serían alrededor de 25 pozos que estarían en el radar de la compañía para este año. Sin embargo, anotó que la cifra podría repuntar los 30. Así lo afirmó en medio del Congreso de la Andi que se lleva a cabo en Cartagena.Bayón anotó que actualmente el país cuenta con 49 contratos.De los cuales, cerca 40% tiene potencial para petróleo líquido y 60% para gas. Estos últimos estarían alineados con la estrategia 2040 de la compañía de convertirse cada vez más gaseosa.El líder de Ecopetrol anotó que el suministro de energía es una de las maneras más contundentes de cerrar las brechas en el país. Sin embargo, eso implicará que la compañía siga fortalecida como se evidenció en los resultados semestrales de la semana pasada.En cuanto a la reforma tributaria, Bayón indicó que tienen el interés por entender en detalle lo que implicará en el caso puntual de Ecopetrol “”pero no solo desde el impuesto, sino el efecto general. Podemos hablar de $4 o $5 billones cuando la reforma sea efectiva. Sin embargo habrá que ver de forma detallada el proceso”.De igual modo, señaló que han tenido conversaciones “productivas” con el nuevo ministro de Hacienda y su equipo técnico para intercambiar opiniones, ideas y analizar el detalle de la medida. “Haremos nuestras estimaciones para saber si la reforma tiene impacto en las inversiones y en la generación de empleo”.“Entendemos la necesidad de que una empresa como nosotros pueda seguir aportando. No es inusual. Hay casi 15 países en el mundo que ya han aplicado cosas parecidas”.Entre otras cosas, Bayón aseguró que desde Ecopetrol se están invirtiendo más de $24 billones para seguir creciendo. Pues su compromiso no es solo con los 250 accionistas, sino con los 50 millones de colombianos.Agregó que el campo de Chuchupa ha sido fundamental para el país, pero también se debe reconocer el esfuerzo por masificar el gas.“Tenemos una ventaja y es que el gas colombiano está en alrededor de $32.000 si fuera importado sería unas cuatro veces más. Por lo tanto, estos descubrimiento no son más que excelentes noticias desde el punto de vista técnico”.“Hoy desde Ecopetrol tenemos la posibilidad de que el gas siga siendo fundamental en la canasta energéticas de los colombianos. Por eso debemos trabajar para desarrollar esa moléculas de manera rápida a los colombianos. Hay muchas oportunidades que se nos abren”.Bayón recordó que el año pasado, la empresa aumentó 80 millones de pies cúbicos la oferta de gas, y este año el comportamiento sigue la misma senda.",[]
2022-09-01 13:56:52,Ecopetrol anunció el descubrimiento de extensión de la gasífera Gorgon-2,10/08/2022,ENERGÍA,El pozo se encuentra ubicado aproximadamente a 70 kilómetros de la costa caribe y fue perforado con un buque de última tecnología para aguas profundas,https://www.larepublica.co/economia/ecopetrol-anuncio-el-descubrimiento-de-extension-de-la-provincia-gasifera-gorgon-2-3422266,"data:image/svg+xml,%3Csvg xmlns='http://www.w3.org/2000/svg' viewBox='0 0 1080 900'%3E%3C/svg%3E",Ecopetrol,JUAN PABLO VARGAS CUELLAR,"Ecopetrol anunció que con la perforación del pozo Gorgon-2, en aguas ultra profundas en el sur del Caribe colombiano, se comprobó la presencia de gas. Se trata de la perforación de mayor profundidad, la cual supera los 4.000 metros aproximadamente.El pozo se encuentra ubicado a unos 70 kilómetros de la costa caribe y fue perforado con un buque de última tecnología para aguas profundas. Al respecto, Felipe Bayón, presidente de Ecopetrol, anunció que el descubrimiento les permitirá avanzar en la evaluación de estos hallazgos en el Caribe Sur, que en caso de un eventual desarrollo dará campo a incrementar las reservas de gas de Colombia"".Asimismo, Gorgon-2 se une al descubrimiento de gas de 2017 en Gorgon-1 y confirma la existencia de una provincia gasífera costa afuera en Colombia. En ella, también se descubrieron Kronos en 2015 y de Purple Angel en 2017.Actualmente Ecopetrol y Shell (operador) son socios en los bloques del Caribe Sur (Col-5,Fuerte Sur y Purple Angel), con 50% de participación cada uno. Para la compañía el desarrollo de esta provincia podría contribuir a mantener la seguridad energética del país y abre la posibilidad para futuras exportaciones.",['https://www.larepublica.co/finanzas/la-accion-de-ecopetrol-ha-caido-mas-de-35-8-desde-que-alcanzo-su-maximo-del-ano-3420335']
