Fecha Extraccion,Titulo,Fecha Publicacion,Tema,Resumen,URL,Imagen,Empresa,Autor,Contenido,RelNewsUrls
2022-09-01 13:56:48,Ecopetrol recibe un reconocimiento por parte de la ONU por proyecto de ecoreservas,24/08/2022,AMBIENTE,Esta red tiene como objetivo preservar la biodiversidad en diferentes partes de la geografía colombiana mediante 15 ecoreservas,https://www.larepublica.co/empresas/ecopetrol-recibe-un-reconocimiento-por-parte-de-la-onu-por-proyecto-de-ecoreservas-3432471,"data:image/svg+xml,%3Csvg xmlns='http://www.w3.org/2000/svg' viewBox='0 0 1080 900'%3E%3C/svg%3E",Ecopetrol,NICOLÁS ESCOBAR ESCOBAR,"Ecopetrol fue distinguida por el Pacto Global Red Colombia como una de las empresas con mayor aporte al logro de los Objetivos de Desarrollo Sostenible (ODS) en el país, mediante la iniciativa “red de ecoreservas” cuyo fin es proteger la biodiversidad y la oferta de servicios económicos en el país.Este premio se otorgó en la quinta versión del Reconocimiento a las Buenas Practicas de Desarrollo Sostenible. “Este reconocimiento es una motivación adicional para continuar trabajando en la implementación de prácticas que respondan a los desafíos ambientales y sociales que enfrentamos hoy como sociedad. La iniciativa de ecoreservas, además de ser pionera en la industria a nivel nacional e internacional, tiene un gran potencial de conservación de nuestra riqueza biológica y de generación de bienestar para las comunidades circundantes”, expresó Santiago Martínez, gerente de Descarbonización y Sostenibilidad de Ecopetrol.Esta red tiene como objetivo preservar la biodiversidad en diferentes partes de la geografía colombiana y a la fecha Ecopetrol cuenta con 15 ecoreservas en una extensión aproximada de 15.000 hectáreas distribuidas en los departamentos de Santander, Bolívar, Meta, Casanare, Huila, Boyacá, Cundinamarca y Córdoba.Además, tienen como meta llegar al 2030 con 50 ecoreservas en línea con el plan de descarbonización y transición energética. Esta iniciativa se desarrolla de la mano del Instituto Humboldt, que le apunta a promover la conectividad entre los ecosistemas, el desarrollo sostenible de los territorios y la mejora en los servicios ecosistémicos.",[]
2022-09-01 13:56:48,"Moody's mantuvo nota de Ecopetrol en Baa3, pero bajó su evaluación crediticia a ba3",24/08/2022,ENERGÍA,La rebaja de la nota del BCA se basa en el largo tiempo para refinanciar US$5.100 millones en deuda y por las política de Petro sobre el petróleo,https://www.larepublica.co/economia/moody-s-mantuvo-nota-de-ecopetrol-en-baa3-pero-bajo-su-evaluacion-crediticia-a-ba3-3432171,"data:image/svg+xml,%3Csvg xmlns='http://www.w3.org/2000/svg' viewBox='0 0 1080 900'%3E%3C/svg%3E",Ecopetrol,BRAYAN XAVIER BECERRA,"Moody's Investors Service decidió mantener las calificaciones senior de Ecopetrol en Baa3, pero rebajó la evaluación crediticia de referencia (BCA) de la empresa a ba3 desde ba1.Esta evaluación crediticia de referencia es una medida de la calificadora del riesgo crediticio intrínseco de la empresa sin consideraciones de respaldo. La agencia recortó esta nota de Ecopetrol por el elevado riesgo de refinanciamiento de la petrolera.Según Moody's, Ecopetrol tiene una política financiera agresiva en medio de en un contexto geopolítico global que está en alto riesgo, principalmente, por la guerra en Ucrania, que ha mantenido una alta volatilidad en los precios de las materias primas como el petróleo.Para la calificadora, la estatal petrolera colombiana se ha tomado un tiempo prolongado para refinanciar cerca de US$5.100 millones en deuda con vencimiento en septiembre de 2023.Esta rebaja también tuvo en cuenta el marco de política gubernamental más débil de la empresa. ""La rebaja de BCA también consideró las prioridades energéticas y ambientales del nuevo gobierno, que pueden incluir cambios como i. restricciones a la exploración y producción basadas en fracturamiento hidráulico en Colombia; ii. limitaciones a nuevas concesiones o permisos para la exploración petrolera; y iii. nuevos impuestos a la industria del petróleo y el gas, según la propuesta de reforma tributaria"", dice Moody's.Aunque la calificadora dice que el riesgo de refinanciamiento de Ecopetrol es elevado, aclara que es manejable, debido a los sólidos precios internacionales que mantienen el petróleo y el gas, lo que ha ayudado a la petrolera a generar efectivo en 2021 y en 2022.Para los próximos dos años, Moody's proyecta un precio base del petróleo Brent entre los US$58 y US$68, en promedio, por lo que ese flujo de efectivo va a disminuir si se compara con los niveles de este año.Pese a los riesgos de refinanciamiento de la compañía y la volatilidad de los precios de los commodities, Moody's asegura que la empresa podrá cumplir con sus obligaciones financieras en 2023 con el apoyo de los mercados de capitales global y colombiano, su línea de crédito bancaria comprometida de US$1.200 millones disponible hasta agosto de 2023; y por el apoyo del gobierno.Perspectiva negativaMoody´s también mantuvo la perspectiva negativa de Ecopetrol. Según la calificadora ese riesgo de refinanciamiento de la petrolera puede permanecer elevado en los próximos meses para mantener una categoría de calificación Baa3.Pero aclara que esta nota senior se mantiene por el ""sólido y relativamente estable"" flujo de efectivo de su filial de transmisión eléctrica, ISA (Baa2 estable) y su subsidiaria midstream, Cenit, que incluye a Oleoducto Central SA (Baa3 estable).",['https://www.larepublica.co/economia/con-el-llamado-a-asamblea-extraordinaria-suenan-cambios-en-la-junta-de-ecopetrol-3431682']
2022-09-01 13:56:49,Con el llamado a asamblea suenan cambios en la Junta de Ecopetrol,24/08/2022,ENERGÍA,"Hace unos días el mismo Ocampo vaticinó posibles cambios en la compañía, pero solo es posible por asamblea extraordinaria",https://www.larepublica.co/economia/con-el-llamado-a-asamblea-extraordinaria-suenan-cambios-en-la-junta-de-ecopetrol-3431682,"data:image/svg+xml,%3Csvg xmlns='http://www.w3.org/2000/svg' viewBox='0 0 1080 900'%3E%3C/svg%3E",Ecopetrol,JUAN PABLO VARGAS CUELLAR,"Desde que comenzó el nuevo Gobierno se viene hablando de posibles modificaciones en los estatutos de Ecopetrol y por ende, cambios en la Junta Directiva, que el propio ministro de Hacienda, José Antonio Ocampo venía planeando incluso antes de posesionarse en la cartera.Esta semana empezarían los movimientos en la Junta de la petrolera. Según contaron ejecutivos de la compañía a LR, entre hoy y mañana, Ocampo tendría su primera reunión con la actual Junta.Si bien hace una semana el mismo Ocampo vaticinó posibles cambios en la Junta Directiva de la compañía, esta solo se podría dar a través de una asamblea de accionistas (la próxima en el calendario está en 2023, pero claramente el Gobierno Petro puede adelantar la fecha). Es decir, esta semana comienzan las reuniones, pero los cambios oficiales se confirmarían hasta que pase esa asamblea extraordinaria.Días antes de llegar al MinHacienda, Ocampo dijo que ""convocaremos a una Junta extraordinaria de accionistas porque Ecopetrol es del Estado, este gobierno (el de Duque) no debe haber tomado las decisiones que tomó porque van en contra de los principios de la posibilidad de cada gobierno. El Gobierno es propietario mayoritario de Ecopetrol y podemos convocar una asamblea"".Se estima que por lo menos serían tres rostros nuevos en la Junta. Lo más seguro está en dos sillas que pediría cambio el Gobierno Petro, según el plan de Ocampo, uno de ellos apunta a la salida de Luis Guillermo Echeverri Abad, actual presidente de la Junta y cercano al expresidente Iván Duque.A comienzos de agosto, el ministro le contó a LR que ese plan de asamblea extraordinaria lo pensaba para septiembre, una vez comenzaran los trámites de la reforma tributaria en el Congreso (algo que ya inició esta semana).A la Junta Directiva también se le sumarían cambios en sus estatutos, los cuales durante la última asamblea sufrieron cambios importantes como la extensión del periodo del gobierno corporativo, el cual pasó de dos años a cuatro. Gracias a esto, los nombres de la Junta actual que llegaron durante el Gobierno del expresidente Iván Duque sumaron más tiempo del planeado.El sonajero de nuevos miembros en la Junta
El sonajero de los posibles reemplazos estaría compuesto según reportes de Bloomberg por el exministro de Minas y Energía, Amylkar Acosta, quien ya estuvo en la Junta durante el Gobierno del expresidente Juan Manuel Santos.Según Bloomberg, otro de los propuestos sería Gonzalo Hernández Jiménez, actual viceministro técnico de Hacienda y Crédito Público. Esta ficha cercana a Ocampo sería miembro como no independiente.",['https://www.larepublica.co/economia/convocaremos-a-una-junta-extraordinaria-de-accionistas-ocampo-sobre-ecopetrol-3402920']
2022-09-01 13:56:49,Ecopetrol reporta nueva sanción de la ANH y anuncia que buscará revocar la decisión,24/08/2022,ENERGÍA,"Se trata de una multa por US$5.000. La petrolera estatal anuncia que ""acata y respeta"" la determinación, relacionada con información en el pozo Conde 22",https://www.larepublica.co/empresas/ecopetrol-reporta-nueva-sancion-de-la-anh-y-anuncia-que-buscara-revocar-la-decision-3431654,"data:image/svg+xml,%3Csvg xmlns='http://www.w3.org/2000/svg' viewBox='0 0 1080 900'%3E%3C/svg%3E",Ecopetrol,IVÁN BERNAL MARÍN,"Ecopetrol reporta que ha recibido una nueva sanción de la Agencia Nacional de Hidrocarburos, ANH, por incumplimiento de procesos de información en la terminación de pozo Conde 22. Se trata de una multa por la suma de US$5.000 según la compañía, equivalentes a alrededor de $21 millones.Se trata de una suma menor al considerar la dimensión de la organización. Con más de $91,7 billones de ingresos en 2021, la petrolera estatal es hoy por hoy la empresa más grande del país. En el primer semestre del año alcanzó ingresos por $76,4 billones, y utilidades por $17,1 billones - más que todas las ganancias generadas el año pasado.De cualquier forma, Ecopetrol, presidida por Felipe Bayón, precisó que ""acata y respeta las decisiones de la ANH"". Sin embargo, también aclaró que ""el actuar de la compañía siempre ha estado enmarcado en el cumplimiento de la normativa legal vigente, por lo que hará uso de los recursos legales procedentes con el objeto de obtener la revocatoria de dicha decisión"".La sanción fue establecida mediante la Resolución No. 875 de 2022, expedida por la Agencia Nacional de Hidrocarburos. Se originó ""por cuanto, a juicio de la ANH, Ecopetrol S.A. habría incumplido los términos establecidos en el artículo 18 de la Resolución No. 181945 de 2009, en lo que respecta a la presentación del Formulario 6 del Informe de Terminación Oficial del Pozo Conde 22"", comunicó la empresa.La empresa, con más de 18.000 empleados y responsable de más del 60% de la producción de hidrocarburos en el país, recientemente había sido notificada de otra sanción de la ANH. En esa ocasión por un valor, mayor, por $1.308 millones, por un caso en el Poliducto Andino.","['https://www.larepublica.co/economia/ecopetrol-gano-en-los-primeros-seis-meses-17-1-billones-fue-mas-del-total-de-2021-3417023', 'https://www.larepublica.co/economia/ecopetrol-acepto-decision-de-la-anla-sobre-sancion-impuesta-en-el-poliducto-andino-3357362']"
2022-09-01 13:56:49,Terpel repuntó en ingresos durante el primer semestre y desbancó a EPM en ranking de ventas hasta junio,22/08/2022,INDUSTRIA,"El ranking de las empresas más vendedoras en el primer semestre se volvió a mover, la distribuidora facturó $1,3 billones más que la de servicios; pero Ecopetrol sigue líder",https://www.larepublica.co/empresas/la-distribuidora-terpel-repunto-en-ingresos-y-desbanco-a-epm-en-ventas-hasta-junio-3429044,"data:image/svg+xml,%3Csvg xmlns='http://www.w3.org/2000/svg' viewBox='0 0 1080 900'%3E%3C/svg%3E",Ecopetrol,ALLISON GUTIÉRREZ NÚÑEZ,"Con una novedad dentro de los primeros tres lugares se reconfiguró el ranking de las empresas más vendedoras en el primer semestre, con los reportes de resultados a la fecha.La que movió el listado de las empresas que han reportado estados financieros, hasta el momento, fue Terpel, que ingresó y se ubicó como la segunda empresa con mayores ingresos, desbancando e EPM, que venía ocupando ese lugar.La distribuidora de combustibles facturo $16,3 billones al cierre de junio, no obstante, sus utilidades no fueron tan altas, en comparación a las de las compañías que ocupan los primeros lugares: $284.000 millones.
Con esta nueva cifra, las cinco primeras empresas que más han vendido de enero a junio suman ahora ingresos en conjunto por $127,5 billones.La que encabeza la lista sigue siendo Ecopetrol, que mantiene su posición histórica con $76,4 billones de ingresos al cierre de junio y $17,1 billones en ganancias. En este caso, sus utilidades marcaron un hito: Ecopetrol ganó más entre enero y junio de 2022 que en el acumulado de las utilidades que generó en 2021 cuando fueron $16,7 billones o $16,3 billones al descontar los totales de ISA.“Como Organización, comprendemos la sostenibilidad como una capacidad habilitadora para generar los resultados que hoy presentamos al mercado”Por lo que tanto Terpel como Ecopetrol reflejan en sus ingresos el buen momento por el que está pasando el sector de hidrocarburos, en el cual, por la crisis geopolítica de la guerra de Rusia contra Ucrania, los precios del petróleo se han disparado.Con la entrada de Terpel, EPM terminó de tercera con $15 billones en ventas y utilidades por el orden de $2,1 billones.“En los primeros seis meses de 2022 hicimos inversiones por $2 billones en múltiples proyectos que adelantamos en el segmento de Generación, Distribución, Aguas y otras iniciativas”, indicó Jorge Andrés Carrillo Cardoso, gerente general de EPM.En la cuarta posición de este resumen de estados financieros empresariales se ubicó Grupo Argos. El holding obtuvo ingresos por $10,5 billones; mientras que el Ebitda y la utilidad del Grupo se situaron en $2,6 billones y $726.000 millones, denotando un crecimiento de 16% y 25%, respectivamente año a año.“Grupo Argos cuenta con fundamentales sólidos que demuestran su capacidad de generación de valor económico”, destacó Jorge Mario Velásquez, presidente de Grupo Argos.El grupo de las cinco más vendedoras a junio lo cierra Grupo Éxito, que obtuvo $9,3 billones en ingresos. El conglomerado, que recién anunció inversiones por $500.000 millones al cierre de 2022, desmontando rumores de una posible salida del país, logró utilidades por $126,8 millones. Para la compañía, sus formatos innovadores fueron grandes jalonadores de los ingresos, sobre todo en el segundo trimestre, pues Éxito Wow representó 30,2% de las ventas totales de la marca y Carulla FreshMarket 46,6%.Las empresas que continúan en el ranking y cierran el top 10 fueron Nutresa con $7,6 billones; Enel, con $5,5 billones; Alpina, con $43.934 millones; y Colombina $43.934 millones.El mercado está a la espera de los balances financieros de otras empresas como Promigas y ETB, para saber cómo queda el mapa de resultados al cierre de junio.","['https://www.larepublica.co/economia/ecopetrol-gano-en-los-primeros-seis-meses-17-1-billones-fue-mas-del-total-de-2021-3417023', 'https://www.larepublica.co/empresas/grupo-exito-reafirma-inversion-en-el-pais-con-500-000-millones-para-el-cierre-de-2022-3426351']"
2022-09-01 13:56:50,Ecopetrol realiza prueba piloto con tecnología 5G en la refinería de Barrancabermeja,18/08/2022,TECNOLOGÍA,"En desarrollo del piloto, mostró acceso a información, imágenes y comunicación en tiempo real y contó con asistencia remota desde Estados Unidos",https://www.larepublica.co/empresas/ecopetrol-realiza-prueba-piloto-con-tecnologia-5g-en-la-refineria-de-barrancabermeja-3427756,"data:image/svg+xml,%3Csvg xmlns='http://www.w3.org/2000/svg' viewBox='0 0 1080 900'%3E%3C/svg%3E",Ecopetrol,MARÍA CAMILA GIL NIEBLES,"La alianza entre Ecopetrol, Accenture, Claro y Microsoft presentó la primera prueba piloto 5G en una refinería en el país. En esta oportunidad fue realizada en la planta HDT (Hidrotratadora), una de las más críticas de la refinería de Barrancabermeja, donde evaluaron el mantenimiento operativo en tiempo récord con dispositivos seguros de realidad aumentada.El desarrollo del piloto mostró acceso a información, imágenes y comunicación en tiempo real y contó con la asistencia remota con personal desde Estados Unidos, quienes guiaron sobre el mantenimiento durante la prueba.Las operaciones fueron aplicadas al mantenimiento en la Refinería en Barrancabermeja.Felipe Bayón, presidente del Grupo Ecopetrol, confía en que esta apuesta les abrirá el camino para la transición energética. “Creemos absolutamente que este es el camino para cumplir con nuestras metas en descarbonización y sostenibilidad, donde la ciencia, la tecnología y la innovación son ejes fundamentales. Trabajamos con una ruta clara y buscamos las mejores alianzas para hacerla realidad”.A su vez, Jaime Galviz, gerente General Andino Sur de Microsoft, señaló que ""dimos una muestra clara de cómo con tecnología podemos mejorar la colaboración entre los equipos multifuncionales, mejorar la capacitación, aumentar la eficiencia y la productividad y optimizar procesos. Con 5G, IoT y la creación de Gemelos Digitales unidos a realidad mixta de Microsoft ya se están habilitando escenarios de colaboración, entrenamiento, asistencia remota alrededor de Colombia, empoderando a las industrias de ingeniería y construcción, atención médica, educación y muchas más"".“Esto es un paso más que damos para que el país inicie un proceso para mejorar la competitividad digital y tecnológica y así aumentar la productividad de sus empresas. Todas estas nuevas tecnologías permiten a las compañías mejorar sus procesos operativos, por lo tanto, ser más productivos y eficientes al atender más solicitudes en el mismo tiempo, entre otros aspectos”, agregó Carlos Zenteno, presidente de Claro Colombia.",[]
2022-09-01 13:56:50,Un vistazo a la transición energética,18/08/2022,CAJA FUERTE,,https://www.larepublica.co/caja-fuerte/un-vistazo-a-la-transicion-energetica-3427095,"data:image/svg+xml,%3Csvg xmlns='http://www.w3.org/2000/svg' viewBox='0 0 1080 900'%3E%3C/svg%3E",Ecopetrol,SIN AUTOR,,[]
2022-09-01 13:56:50,Las empresas que están en vilo ante la posible importación de gas desde Venezuela,17/08/2022,ENERGÍA,"En el negocio de distribución y comercialización de gas se destacan Vanti, Promigas, EPM, Alcanos, Llanogas y Gases de Occidente",https://www.larepublica.co/empresas/las-empresas-que-estan-en-vilo-ante-la-posible-importacion-de-gas-desde-venezuela-3426430,"data:image/svg+xml,%3Csvg xmlns='http://www.w3.org/2000/svg' viewBox='0 0 1080 900'%3E%3C/svg%3E",Ecopetrol,NATALIA GAVIRIA GONZÁLEZ,"El sector del gas en Colombia está sacudido por la reciente posibilidad de que se detenga la exploración y en su reemplazo, sea importado desde Venezuela como lo aseguró la nueva ministra de Minas y Energía Irene Vélez.Según manifestó la titular de Minas y Energía, Colombia tiene reservas de gas para siete u ocho años, por lo que si se necesitara llenar la matriz energética, ""se podría hacer la conexión de transporte de gas con Venezuela"", que tiene contemplado elevar la producción de hidrocarburos y de gas este año.Se trata de un momento coyuntural que además ha coincidido con el reciente anuncio de Ecopetrol sobre dos hallazgos importantes de una posible provincia gasífera frente a la Costa Caribe colombiana.Ante este panorama vale la pena revisar la dinámica del sector así como las empresas que lo lideran. No obstante, es importante señalar que en la cadena de esta industria hay quienes se encargan de la exploración, otras de la distribución y finalmente, están las responsables de la comercialización con el usuario final.En la cadena de exploración se destacan compañías como Ecopetrol, que mantiene su hegemonía con una participación de 58% del mercado y Hocol, del Grupo Empresarial Ecopetrol, que tiene 21% de peso en el ranking de las compañías más importantes que explotan gas.Canacol Energy, Lewis Energy Colombia y Petrosantander son otras de las empresas relacionadas con las operaciones de gas: su participación es de 7%, 3% y 3%, respectivamente. Así mismo, Parex Resources (2%), Unión Temporal Omega Enery (1%) y Petróleos Sud Americanos (1%) que también contribuyen a la explotación de este recurso natural.Aparecen además Cepsa, Frontera Energy, Mansarovar Energy Colombia, Occidental y Perenco Colombia.En cuanto al negocio de distribución y comercialización de gas natural se dice que está en manos de seis grandes grupos entre los que se destacan Vanti, Promigas, EPM, Alcanos, Llanogas y Gases de Occidente. Estas compañías concentran cerca del 85% de las operaciones del sector que en total genera que más de $9 billones en ingresos y $1 billón en utilidad.Fuentes de este sector indicaron que en el caso de la distribuidoras la afectación es directamente en los precios del metro cúbico al usuario, independientemente que sea de Venezuela o de otro país, porque si se importa el precio que se pague en el mercado internacional es el que se le va a cobrar a los usuarios residenciales, comerciales, industriales y de movilidad con gas natural vehicular.Luz Stella Murgas, presidenta de Naturgas, indicó que Colombia tiene soberanía y autosuficiencia energética. De hecho, el potencial de producción de gas aumentó 8% para el periodo 2022-2023 en 58 gbtud promedio, con un total disponible de 320 gbtud promedio para la venta, según el reporte generado por las empresas en la última declaración.""Contamos con 3,16 terapies cúbicos de reservas probadas, lo que es equivalente a una autosuficiencia de 8 años. Estas cifras representan un aumento de 7,3% en las reservas gasíferas, lo que se traduce en 215 gigapies cúbicos adicionales, como resultado de los descubrimientos de las últimas campañas exploratorias. Una prueba más de que Colombia no depende del gas de otros países de la región"", sostuvo.Murgas señaló que tomando como referencia no solo las reservas probadas sino las probables y posibles, la autosuficiencia del país totalizaría en 11,4 años, sin incluir nuevos descubrimientos como los pozos en lecho marino. ""Tenemos 689 gigapies cúbicos de reservas probables y 640 gigapies cúbicos de posibles. Y, a pesar de que están identificados los recursos anteriormente mencionados, la autosuficiencia nacional de gas natural podría llegar a ser de hasta 100 años, pues hay un potencial de hasta 60 terapies cúbicos"".",['https://www.larepublica.co/economia/ante-posible-insuficiencia-de-gas-el-pais-contemplaria-importacion-desde-venezuela-3423652']
